number,value,datetime_start,datetime_complete,duration,params_exog__cpi_fresh_fruits,params_exog__diesel_price,params_exog__mxn_usd,params_exog__ppi_fertilizers,params_model,params_strategy,params_transform,params_use_tda,params_window,state
267,26.90375939287572,2026-06-08 09:34:42.760459,2026-06-08 09:34:43.163808,0 days 00:00:00.403349,False,False,True,True,SVR_rbf,dummy,log_diff,False,12,COMPLETE
268,28.010944961008157,2026-06-08 09:34:42.851019,2026-06-08 09:34:43.276055,0 days 00:00:00.425036,False,False,True,True,SVR_rbf,dummy,standard,False,12,COMPLETE
269,22.60551269861375,2026-06-08 09:34:42.923826,2026-06-08 09:34:43.283274,0 days 00:00:00.359448,False,False,True,True,Lasso,dummy,standard,False,12,COMPLETE
270,28.010944961008157,2026-06-08 09:34:42.956298,2026-06-08 09:34:43.387772,0 days 00:00:00.431474,False,False,True,True,SVR_rbf,dummy,standard,False,12,COMPLETE
271,28.010944961008157,2026-06-08 09:34:43.001793,2026-06-08 09:34:43.402940,0 days 00:00:00.401147,False,False,True,True,SVR_rbf,dummy,standard,False,12,COMPLETE
272,28.010944961008157,2026-06-08 09:34:43.021562,2026-06-08 09:34:43.479761,0 days 00:00:00.458199,False,False,True,True,SVR_rbf,dummy,standard,False,12,COMPLETE
273,28.010944961008157,2026-06-08 09:34:43.039278,2026-06-08 09:34:43.458284,0 days 00:00:00.419006,False,False,True,True,SVR_rbf,dummy,standard,False,12,COMPLETE
274,22.60551269861375,2026-06-08 09:34:43.165307,2026-06-08 09:34:43.520172,0 days 00:00:00.354865,False,False,True,True,Lasso,dummy,standard,False,12,COMPLETE
275,27.431129616455475,2026-06-08 09:34:43.284678,2026-06-08 09:34:43.566501,0 days 00:00:00.281823,False,False,True,True,Lasso,dummy,standard,False,48,COMPLETE
276,27.431129616455475,2026-06-08 09:34:43.286614,2026-06-08 09:34:43.549638,0 days 00:00:00.263024,False,False,True,True,Lasso,dummy,standard,False,48,COMPLETE
277,22.60551269861375,2026-06-08 09:34:43.390969,2026-06-08 09:34:43.798409,0 days 00:00:00.407440,False,False,True,True,Lasso,dummy,standard,False,12,COMPLETE
278,27.431129616455475,2026-06-08 09:34:43.405660,2026-06-08 09:34:43.672443,0 days 00:00:00.266783,False,False,True,True,Lasso,dummy,standard,False,48,COMPLETE
279,22.60551269861375,2026-06-08 09:34:43.461253,2026-06-08 09:34:43.845115,0 days 00:00:00.383862,False,False,True,True,Lasso,dummy,standard,False,12,COMPLETE
280,27.431129616455475,2026-06-08 09:34:43.482298,2026-06-08 09:34:43.809889,0 days 00:00:00.327591,False,False,True,True,Lasso,dummy,standard,False,48,COMPLETE
281,27.431129616455475,2026-06-08 09:34:43.524383,2026-06-08 09:34:43.837810,0 days 00:00:00.313427,False,False,True,True,Lasso,dummy,standard,False,48,COMPLETE
282,22.60551269861375,2026-06-08 09:34:43.560331,2026-06-08 09:34:43.951359,0 days 00:00:00.391028,False,False,True,True,Lasso,dummy,standard,False,12,COMPLETE
283,31.23024879959798,2026-06-08 09:34:43.571059,2026-06-08 09:34:43.929615,0 days 00:00:00.358556,False,False,True,True,Lasso,dummy,seasonal_diff,False,12,COMPLETE
284,22.60551269861375,2026-06-08 09:34:43.676500,2026-06-08 09:34:44.094798,0 days 00:00:00.418298,False,False,True,True,Lasso,dummy,standard,False,12,COMPLETE
285,22.60551269861375,2026-06-08 09:34:43.800286,2026-06-08 09:34:44.157538,0 days 00:00:00.357252,False,False,True,True,Lasso,dummy,standard,False,12,COMPLETE
286,22.60551269861375,2026-06-08 09:34:43.812892,2026-06-08 09:34:44.238083,0 days 00:00:00.425191,False,False,True,True,Lasso,dummy,standard,False,12,COMPLETE
287,31.23024879959798,2026-06-08 09:34:43.845847,2026-06-08 09:34:44.258300,0 days 00:00:00.412453,False,False,True,True,Lasso,dummy,seasonal_diff,False,12,COMPLETE
288,22.60551269861375,2026-06-08 09:34:43.849223,2026-06-08 09:34:44.211248,0 days 00:00:00.362025,False,False,True,True,Lasso,dummy,standard,False,12,COMPLETE
289,22.60551269861375,2026-06-08 09:34:43.932473,2026-06-08 09:34:44.327902,0 days 00:00:00.395429,False,False,True,True,Lasso,dummy,standard,False,12,COMPLETE
290,26.398198229528163,2026-06-08 09:34:43.953104,2026-06-08 09:34:44.344145,0 days 00:00:00.391041,False,False,True,True,Lasso,dummy,diff,False,12,COMPLETE
291,26.398198229528163,2026-06-08 09:34:44.095724,2026-06-08 09:34:44.458192,0 days 00:00:00.362468,False,False,True,True,Lasso,dummy,diff,False,12,COMPLETE
292,22.60551269861375,2026-06-08 09:34:44.162537,2026-06-08 09:34:44.517698,0 days 00:00:00.355161,False,False,True,True,Lasso,dummy,standard,False,12,COMPLETE
293,26.398198229528163,2026-06-08 09:34:44.213104,2026-06-08 09:34:44.609024,0 days 00:00:00.395920,False,False,True,True,Lasso,dummy,diff,False,12,COMPLETE
294,31.059819506989363,2026-06-08 09:34:44.245174,2026-06-08 09:34:44.637367,0 days 00:00:00.392193,False,False,True,True,Lasso,dummy,diff,False,24,COMPLETE
295,31.059819506989363,2026-06-08 09:34:44.265800,2026-06-08 09:34:44.601828,0 days 00:00:00.336028,False,False,True,True,Lasso,dummy,diff,False,24,COMPLETE
296,22.60551269861375,2026-06-08 09:34:44.329390,2026-06-08 09:34:44.735758,0 days 00:00:00.406368,False,False,True,True,Lasso,dummy,standard,False,12,COMPLETE
297,22.60551269861375,2026-06-08 09:34:44.346188,2026-06-08 09:34:44.708274,0 days 00:00:00.362086,False,False,True,True,Lasso,dummy,standard,False,12,COMPLETE
298,24.78113171916867,2026-06-08 09:34:44.466404,2026-06-08 09:34:44.834366,0 days 00:00:00.367962,False,False,True,True,Lasso,dummy,standard,False,24,COMPLETE
299,22.60551269861375,2026-06-08 09:34:44.524391,2026-06-08 09:34:44.891487,0 days 00:00:00.367096,False,False,True,True,Lasso,dummy,standard,False,12,COMPLETE
300,22.75447818591928,2026-06-08 09:34:44.611362,2026-06-08 09:34:45.090897,0 days 00:00:00.479535,False,False,True,True,Lasso,dummy,standard,True,12,COMPLETE
301,22.75447818591928,2026-06-08 09:34:44.613796,2026-06-08 09:34:45.101012,0 days 00:00:00.487216,False,False,True,True,Lasso,dummy,standard,True,12,COMPLETE
302,22.60551269861375,2026-06-08 09:34:44.638240,2026-06-08 09:34:45.005279,0 days 00:00:00.367039,False,False,True,True,Lasso,dummy,standard,False,12,COMPLETE
303,22.60551269861375,2026-06-08 09:34:44.710525,2026-06-08 09:34:45.057651,0 days 00:00:00.347126,False,False,True,True,Lasso,dummy,standard,False,12,COMPLETE
304,22.75447818591928,2026-06-08 09:34:44.738147,2026-06-08 09:34:45.198094,0 days 00:00:00.459947,False,False,True,True,Lasso,dummy,standard,True,12,COMPLETE
305,22.60551269861375,2026-06-08 09:34:44.836544,2026-06-08 09:34:45.160632,0 days 00:00:00.324088,False,False,True,True,Lasso,dummy,standard,False,12,COMPLETE
306,22.75447818591928,2026-06-08 09:34:44.893972,2026-06-08 09:34:45.341722,0 days 00:00:00.447750,False,False,True,True,Lasso,dummy,standard,True,12,COMPLETE
307,22.75447818591928,2026-06-08 09:34:45.006498,2026-06-08 09:34:45.466249,0 days 00:00:00.459751,False,False,True,True,Lasso,dummy,standard,True,12,COMPLETE
308,22.60551269861375,2026-06-08 09:34:45.059750,2026-06-08 09:34:45.437225,0 days 00:00:00.377475,False,False,True,True,Lasso,dummy,standard,False,12,COMPLETE
309,22.60551269861375,2026-06-08 09:34:45.091891,2026-06-08 09:34:45.421926,0 days 00:00:00.330035,False,False,True,True,Lasso,dummy,standard,False,12,COMPLETE
310,22.60551269861375,2026-06-08 09:34:45.101921,2026-06-08 09:34:45.455374,0 days 00:00:00.353453,False,False,True,True,Lasso,dummy,standard,False,12,COMPLETE
311,22.60551269861375,2026-06-08 09:34:45.163831,2026-06-08 09:34:45.491322,0 days 00:00:00.327491,False,False,True,True,Lasso,dummy,standard,False,12,COMPLETE
312,26.65176970230794,2026-06-08 09:34:45.200859,2026-06-08 09:34:45.517196,0 days 00:00:00.316337,False,False,True,True,Lasso,dummy,standard,False,36,COMPLETE
313,26.65176970230794,2026-06-08 09:34:45.342532,2026-06-08 09:34:45.621814,0 days 00:00:00.279282,False,False,True,True,Lasso,dummy,standard,False,36,COMPLETE
314,32.3154526290955,2026-06-08 09:34:45.423273,2026-06-08 09:34:48.432139,0 days 00:00:03.008866,False,False,True,True,GradientBoosting,dummy,standard,False,36,COMPLETE
315,26.65176970230794,2026-06-08 09:34:45.440128,2026-06-08 09:34:45.729767,0 days 00:00:00.289639,False,False,True,True,Lasso,dummy,standard,False,36,COMPLETE
316,26.65176970230794,2026-06-08 09:34:45.457142,2026-06-08 09:34:45.754872,0 days 00:00:00.297730,False,False,True,True,Lasso,dummy,standard,False,36,COMPLETE
317,33.48057146602068,2026-06-08 09:34:45.467209,2026-06-08 09:34:45.768330,0 days 00:00:00.301121,False,False,True,True,Lasso,dummy,none,False,36,COMPLETE
318,35.1429225925926,2026-06-08 09:34:45.492933,2026-06-08 09:34:45.808493,0 days 00:00:00.315560,False,False,True,True,DecisionTree,dummy,none,False,36,COMPLETE
319,31.318093867187503,2026-06-08 09:34:45.520552,2026-06-08 09:34:45.854473,0 days 00:00:00.333921,False,False,True,True,DecisionTree,dummy,none,False,12,COMPLETE
320,25.89426832247565,2026-06-08 09:34:45.623344,2026-06-08 09:34:48.879622,0 days 00:00:03.256278,False,False,True,True,GradientBoosting,dummy,standard,False,12,COMPLETE
321,29.89372516059028,2026-06-08 09:34:45.731523,2026-06-08 09:34:45.978336,0 days 00:00:00.246813,False,False,True,True,DecisionTree,dummy,standard,False,12,COMPLETE
322,25.89426832247565,2026-06-08 09:34:45.756181,2026-06-08 09:34:48.950575,0 days 00:00:03.194394,False,False,True,True,GradientBoosting,exclude,standard,False,12,COMPLETE
323,25.89426832247565,2026-06-08 09:34:45.770517,2026-06-08 09:34:49.020828,0 days 00:00:03.250311,False,False,True,True,GradientBoosting,dummy,standard,False,12,COMPLETE
324,22.60551269861375,2026-06-08 09:34:45.812194,2026-06-08 09:34:46.037128,0 days 00:00:00.224934,False,False,True,True,Lasso,exclude,standard,False,12,COMPLETE
325,25.89426832247565,2026-06-08 09:34:45.856099,2026-06-08 09:34:48.970416,0 days 00:00:03.114317,False,False,True,True,GradientBoosting,dummy,standard,False,12,COMPLETE
326,22.60551269861375,2026-06-08 09:34:45.980175,2026-06-08 09:34:46.172376,0 days 00:00:00.192201,False,False,True,True,Lasso,dummy,standard,False,12,COMPLETE
327,22.60551269861375,2026-06-08 09:34:46.038700,2026-06-08 09:34:46.239326,0 days 00:00:00.200626,False,False,True,True,Lasso,dummy,standard,False,12,COMPLETE
328,22.60551269861375,2026-06-08 09:34:46.173689,2026-06-08 09:34:46.370472,0 days 00:00:00.196783,False,False,True,True,Lasso,dummy,standard,False,12,COMPLETE
329,22.60551269861375,2026-06-08 09:34:46.240586,2026-06-08 09:34:46.442308,0 days 00:00:00.201722,False,False,True,True,Lasso,dummy,standard,False,12,COMPLETE
330,22.60551269861375,2026-06-08 09:34:46.372313,2026-06-08 09:34:46.575661,0 days 00:00:00.203348,False,False,True,True,Lasso,dummy,standard,False,12,COMPLETE
331,22.60551269861375,2026-06-08 09:34:46.443265,2026-06-08 09:34:46.640831,0 days 00:00:00.197566,False,False,True,True,Lasso,dummy,standard,False,12,COMPLETE
332,25.89426832247565,2026-06-08 09:34:46.578297,2026-06-08 09:34:49.919361,0 days 00:00:03.341064,False,False,True,True,GradientBoosting,dummy,standard,False,12,COMPLETE
333,25.89426832247565,2026-06-08 09:34:46.643257,2026-06-08 09:34:50.116076,0 days 00:00:03.472819,False,False,True,True,GradientBoosting,dummy,standard,False,12,COMPLETE
334,22.60551269861375,2026-06-08 09:34:48.433361,2026-06-08 09:34:48.553988,0 days 00:00:00.120627,False,False,True,True,Lasso,dummy,standard,False,12,COMPLETE
335,22.60551269861375,2026-06-08 09:34:48.555136,2026-06-08 09:34:48.653895,0 days 00:00:00.098759,False,False,True,True,Lasso,dummy,standard,False,12,COMPLETE
336,22.60551269861375,2026-06-08 09:34:48.656470,2026-06-08 09:34:48.766716,0 days 00:00:00.110246,False,False,True,True,Lasso,dummy,standard,False,12,COMPLETE
337,31.23024879959798,2026-06-08 09:34:48.768181,2026-06-08 09:34:48.905505,0 days 00:00:00.137324,False,False,True,True,Lasso,dummy,seasonal_diff,False,12,COMPLETE
338,22.60551269861375,2026-06-08 09:34:48.880563,2026-06-08 09:34:49.190367,0 days 00:00:00.309804,False,False,True,True,Lasso,dummy,standard,False,12,COMPLETE
339,22.60551269861375,2026-06-08 09:34:48.907856,2026-06-08 09:34:49.224459,0 days 00:00:00.316603,False,False,True,True,Lasso,dummy,standard,False,12,COMPLETE
340,22.60551269861375,2026-06-08 09:34:48.951934,2026-06-08 09:34:49.244475,0 days 00:00:00.292541,False,False,True,True,Lasso,dummy,standard,False,12,COMPLETE
341,22.60551269861375,2026-06-08 09:34:48.973934,2026-06-08 09:34:49.281165,0 days 00:00:00.307231,False,False,True,True,Lasso,dummy,standard,False,12,COMPLETE
342,22.60551269861375,2026-06-08 09:34:49.025147,2026-06-08 09:34:49.335895,0 days 00:00:00.310748,False,False,True,True,Lasso,dummy,standard,False,12,COMPLETE
343,22.60551269861375,2026-06-08 09:34:49.193183,2026-06-08 09:34:49.487646,0 days 00:00:00.294463,False,False,True,True,Lasso,dummy,standard,False,12,COMPLETE
344,22.60551269861375,2026-06-08 09:34:49.226281,2026-06-08 09:34:49.562053,0 days 00:00:00.335772,False,False,True,True,Lasso,dummy,standard,False,12,COMPLETE
345,22.60551269861375,2026-06-08 09:34:49.257020,2026-06-08 09:34:49.537317,0 days 00:00:00.280297,False,False,True,True,Lasso,dummy,standard,False,12,COMPLETE
346,22.60551269861375,2026-06-08 09:34:49.283175,2026-06-08 09:34:49.600774,0 days 00:00:00.317599,False,False,True,True,Lasso,dummy,standard,False,12,COMPLETE
347,22.60551269861375,2026-06-08 09:34:49.339799,2026-06-08 09:34:49.624886,0 days 00:00:00.285087,False,False,True,True,Lasso,dummy,standard,False,12,COMPLETE
348,22.60551269861375,2026-06-08 09:34:49.489952,2026-06-08 09:34:49.821619,0 days 00:00:00.331667,False,False,True,True,Lasso,dummy,standard,False,12,COMPLETE
349,22.60551269861375,2026-06-08 09:34:49.539043,2026-06-08 09:34:49.869075,0 days 00:00:00.330032,False,False,True,True,Lasso,dummy,standard,False,12,COMPLETE
350,22.60551269861375,2026-06-08 09:34:49.565000,2026-06-08 09:34:49.875328,0 days 00:00:00.310328,False,False,True,True,Lasso,dummy,standard,False,12,COMPLETE
351,24.505854583333335,2026-06-08 09:34:49.602226,2026-06-08 09:34:50.011346,0 days 00:00:00.409120,False,False,True,True,KNN,dummy,standard,False,12,COMPLETE
352,24.505854583333335,2026-06-08 09:34:49.627168,2026-06-08 09:34:50.025045,0 days 00:00:00.397877,False,False,True,True,KNN,dummy,standard,False,12,COMPLETE
353,24.505854583333335,2026-06-08 09:34:49.828022,2026-06-08 09:34:50.273088,0 days 00:00:00.445066,False,False,True,True,KNN,dummy,standard,False,12,COMPLETE
354,24.505854583333335,2026-06-08 09:34:49.882198,2026-06-08 09:34:50.384101,0 days 00:00:00.501903,False,False,True,True,KNN,dummy,standard,False,12,COMPLETE
355,22.60551269861375,2026-06-08 09:34:49.883696,2026-06-08 09:34:50.306038,0 days 00:00:00.422342,False,False,True,True,Lasso,dummy,standard,False,12,COMPLETE
356,22.60551269861375,2026-06-08 09:34:49.920974,2026-06-08 09:34:50.360564,0 days 00:00:00.439590,False,False,True,True,Lasso,dummy,standard,False,12,COMPLETE
357,22.60551269861375,2026-06-08 09:34:50.020054,2026-06-08 09:34:50.433669,0 days 00:00:00.413615,False,False,True,True,Lasso,dummy,standard,False,12,COMPLETE
358,22.60551269861375,2026-06-08 09:34:50.028457,2026-06-08 09:34:50.449879,0 days 00:00:00.421422,False,False,True,True,Lasso,dummy,standard,False,12,COMPLETE
359,22.60551269861375,2026-06-08 09:34:50.118081,2026-06-08 09:34:50.503106,0 days 00:00:00.385025,False,False,True,True,Lasso,dummy,standard,False,12,COMPLETE
360,22.60551269861375,2026-06-08 09:34:50.275216,2026-06-08 09:34:50.709885,0 days 00:00:00.434669,False,False,True,True,Lasso,dummy,standard,False,12,COMPLETE
361,31.23024879959798,2026-06-08 09:34:50.307972,2026-06-08 09:34:50.725556,0 days 00:00:00.417584,False,False,True,True,Lasso,dummy,seasonal_diff,False,12,COMPLETE
362,31.23024879959798,2026-06-08 09:34:50.365185,2026-06-08 09:34:50.777294,0 days 00:00:00.412109,False,False,True,True,Lasso,dummy,seasonal_diff,False,12,COMPLETE
363,31.23024879959798,2026-06-08 09:34:50.387968,2026-06-08 09:34:50.773789,0 days 00:00:00.385821,False,False,True,True,Lasso,dummy,seasonal_diff,False,12,COMPLETE
364,31.23024879959798,2026-06-08 09:34:50.435272,2026-06-08 09:34:50.859234,0 days 00:00:00.423962,False,False,True,True,Lasso,dummy,seasonal_diff,False,12,COMPLETE
365,37.52434992289438,2026-06-08 09:34:50.452062,2026-06-08 09:34:50.808495,0 days 00:00:00.356433,False,False,True,True,Lasso,dummy,seasonal_diff,False,24,COMPLETE
366,22.60551269861375,2026-06-08 09:34:50.505370,2026-06-08 09:34:50.932520,0 days 00:00:00.427150,False,False,True,True,Lasso,exclude,standard,False,12,COMPLETE
367,31.23024879959798,2026-06-08 09:34:50.711616,2026-06-08 09:34:51.127504,0 days 00:00:00.415888,False,False,True,True,Lasso,dummy,seasonal_diff,False,12,COMPLETE
368,22.60551269861375,2026-06-08 09:34:50.727402,2026-06-08 09:34:51.206277,0 days 00:00:00.478875,False,False,True,True,Lasso,dummy,standard,False,12,COMPLETE
369,24.78113171916867,2026-06-08 09:34:50.775728,2026-06-08 09:34:51.187640,0 days 00:00:00.411912,False,False,True,True,Lasso,exclude,standard,False,24,COMPLETE
370,24.413511411047246,2026-06-08 09:34:50.779504,2026-06-08 09:34:51.174997,0 days 00:00:00.395493,False,False,True,True,ElasticNet,exclude,standard,False,24,COMPLETE
371,22.93841048126706,2026-06-08 09:34:50.809829,2026-06-08 09:34:51.252394,0 days 00:00:00.442565,False,False,True,True,ElasticNet,dummy,standard,False,12,COMPLETE
372,22.60551269861375,2026-06-08 09:34:50.865986,2026-06-08 09:34:51.312655,0 days 00:00:00.446669,False,False,True,True,Lasso,exclude,standard,False,12,COMPLETE
373,22.93841048126706,2026-06-08 09:34:50.935356,2026-06-08 09:34:51.348870,0 days 00:00:00.413514,False,False,True,True,ElasticNet,dummy,standard,False,12,COMPLETE
374,22.93841048126706,2026-06-08 09:34:51.128789,2026-06-08 09:34:51.547084,0 days 00:00:00.418295,False,False,True,True,ElasticNet,dummy,standard,False,12,COMPLETE
375,22.60551269861375,2026-06-08 09:34:51.177370,2026-06-08 09:34:51.607718,0 days 00:00:00.430348,False,False,True,True,Lasso,dummy,standard,False,12,COMPLETE
376,22.60551269861375,2026-06-08 09:34:51.192394,2026-06-08 09:34:51.575700,0 days 00:00:00.383306,False,False,True,True,Lasso,dummy,standard,False,12,COMPLETE
377,22.60551269861375,2026-06-08 09:34:51.213349,2026-06-08 09:34:51.606231,0 days 00:00:00.392882,False,False,True,True,Lasso,dummy,standard,False,12,COMPLETE
378,22.60551269861375,2026-06-08 09:34:51.260368,2026-06-08 09:34:51.654383,0 days 00:00:00.394015,False,False,True,True,Lasso,dummy,standard,False,12,COMPLETE
379,22.60551269861375,2026-06-08 09:34:51.314625,2026-06-08 09:34:51.691463,0 days 00:00:00.376838,False,False,True,True,Lasso,dummy,standard,False,12,COMPLETE
380,22.60551269861375,2026-06-08 09:34:51.356024,2026-06-08 09:34:51.693054,0 days 00:00:00.337030,False,False,True,True,Lasso,dummy,standard,False,12,COMPLETE
381,22.60551269861375,2026-06-08 09:34:51.550533,2026-06-08 09:34:51.894820,0 days 00:00:00.344287,False,False,True,True,Lasso,dummy,standard,False,12,COMPLETE
382,22.60551269861375,2026-06-08 09:34:51.577422,2026-06-08 09:34:51.990712,0 days 00:00:00.413290,False,False,True,True,Lasso,dummy,standard,False,12,COMPLETE
383,22.60551269861375,2026-06-08 09:34:51.609414,2026-06-08 09:34:52.010743,0 days 00:00:00.401329,False,False,True,True,Lasso,dummy,standard,False,12,COMPLETE
384,22.60551269861375,2026-06-08 09:34:51.613110,2026-06-08 09:34:52.020535,0 days 00:00:00.407425,False,False,True,True,Lasso,dummy,standard,False,12,COMPLETE
385,22.60551269861375,2026-06-08 09:34:51.659346,2026-06-08 09:34:52.097939,0 days 00:00:00.438593,False,False,True,True,Lasso,dummy,standard,False,12,COMPLETE
386,22.60551269861375,2026-06-08 09:34:51.711804,2026-06-08 09:34:52.100809,0 days 00:00:00.389005,False,False,True,True,Lasso,dummy,standard,False,12,COMPLETE
387,22.60551269861375,2026-06-08 09:34:51.715400,2026-06-08 09:34:52.076408,0 days 00:00:00.361008,False,False,True,True,Lasso,dummy,standard,False,12,COMPLETE
388,37.92318508341181,2026-06-08 09:34:51.895931,2026-06-08 09:34:52.228159,0 days 00:00:00.332228,False,False,True,True,Ridge,dummy,standard,False,48,COMPLETE
389,26.91990504047213,2026-06-08 09:34:51.992147,2026-06-08 09:34:53.695032,0 days 00:00:01.702885,False,False,True,True,Lasso,dummy,standard,True,48,COMPLETE
390,27.431129616455475,2026-06-08 09:34:52.013051,2026-06-08 09:34:52.394864,0 days 00:00:00.381813,False,False,True,True,Lasso,dummy,standard,False,48,COMPLETE
391,477.9860404016504,2026-06-08 09:34:52.022996,2026-06-08 09:34:52.501431,0 days 00:00:00.478435,False,False,True,True,LinearRegression,dummy,standard,False,48,COMPLETE
392,39.879501351680275,2026-06-08 09:34:52.077804,2026-06-08 09:34:53.912585,0 days 00:00:01.834781,False,False,True,True,Ridge,dummy,none,True,48,COMPLETE
393,39.879501351680275,2026-06-08 09:34:52.101708,2026-06-08 09:34:53.934782,0 days 00:00:01.833074,False,False,True,True,Ridge,dummy,none,True,48,COMPLETE
394,28.566071831871437,2026-06-08 09:34:52.106880,2026-06-08 09:34:53.150219,0 days 00:00:01.043339,False,False,True,True,Ridge,winsorize,none,True,12,COMPLETE
395,33.67788567192178,2026-06-08 09:34:52.229782,2026-06-08 09:34:53.301333,0 days 00:00:01.071551,False,False,True,True,LinearRegression,dummy,none,True,12,COMPLETE
396,33.67788567192178,2026-06-08 09:34:52.396238,2026-06-08 09:34:53.611678,0 days 00:00:01.215440,False,False,True,True,LinearRegression,winsorize,none,True,12,COMPLETE
397,27.9269888187317,2026-06-08 09:34:52.512159,2026-06-08 09:34:53.428216,0 days 00:00:00.916057,False,False,True,True,Lasso,dummy,log_diff,True,12,COMPLETE
398,27.744160741358662,2026-06-08 09:34:53.162955,2026-06-08 09:34:53.827850,0 days 00:00:00.664895,False,False,True,True,Lasso,dummy,log_diff,False,12,COMPLETE
399,27.744160741358662,2026-06-08 09:34:53.309146,2026-06-08 09:34:54.002385,0 days 00:00:00.693239,False,False,True,True,Lasso,dummy,log_diff,False,12,COMPLETE
400,22.60551269861375,2026-06-08 09:34:53.435142,2026-06-08 09:34:54.065967,0 days 00:00:00.630825,False,False,True,True,Lasso,dummy,standard,False,12,COMPLETE
