number,value,datetime_start,datetime_complete,duration,params_exog__cpi_fresh_fruits,params_exog__diesel_price,params_exog__mxn_usd,params_exog__ppi_fertilizers,params_model,params_strategy,params_transform,params_use_tda,params_window,state
401,22.60551269861375,2026-06-08 09:34:53.614984,2026-06-08 09:34:54.174614,0 days 00:00:00.559630,False,False,True,True,Lasso,dummy,standard,False,12,COMPLETE
402,22.60551269861375,2026-06-08 09:34:53.702763,2026-06-08 09:34:54.233356,0 days 00:00:00.530593,False,False,True,True,Lasso,dummy,standard,False,12,COMPLETE
403,22.60551269861375,2026-06-08 09:34:53.836900,2026-06-08 09:34:54.276289,0 days 00:00:00.439389,False,False,True,True,Lasso,dummy,standard,False,12,COMPLETE
404,22.60551269861375,2026-06-08 09:34:53.924524,2026-06-08 09:34:54.323607,0 days 00:00:00.399083,False,False,True,True,Lasso,dummy,standard,False,12,COMPLETE
405,22.60551269861375,2026-06-08 09:34:53.937329,2026-06-08 09:34:54.293101,0 days 00:00:00.355772,False,False,True,True,Lasso,dummy,standard,False,12,COMPLETE
406,22.60551269861375,2026-06-08 09:34:54.007609,2026-06-08 09:34:54.414624,0 days 00:00:00.407015,False,False,True,True,Lasso,dummy,standard,False,12,COMPLETE
407,22.60551269861375,2026-06-08 09:34:54.067148,2026-06-08 09:34:54.433517,0 days 00:00:00.366369,False,False,True,True,Lasso,dummy,standard,False,12,COMPLETE
408,29.89372516059028,2026-06-08 09:34:54.182136,2026-06-08 09:34:54.565183,0 days 00:00:00.383047,False,False,True,True,DecisionTree,dummy,standard,False,12,COMPLETE
409,29.89372516059028,2026-06-08 09:34:54.236122,2026-06-08 09:34:54.606818,0 days 00:00:00.370696,False,False,True,True,DecisionTree,dummy,standard,False,12,COMPLETE
410,29.89372516059028,2026-06-08 09:34:54.278107,2026-06-08 09:34:54.666300,0 days 00:00:00.388193,False,False,True,True,DecisionTree,dummy,standard,False,12,COMPLETE
411,32.37214515783779,2026-06-08 09:34:54.295330,2026-06-08 09:34:54.659295,0 days 00:00:00.363965,False,True,True,True,Lasso,dummy,diff,False,12,COMPLETE
412,37.8707431640625,2026-06-08 09:34:54.327477,2026-06-08 09:34:54.721862,0 days 00:00:00.394385,False,True,True,True,DecisionTree,dummy,diff,False,12,COMPLETE
413,22.62413338452694,2026-06-08 09:34:54.418789,2026-06-08 09:34:54.748268,0 days 00:00:00.329479,False,True,True,True,Lasso,dummy,standard,False,12,COMPLETE
414,37.8707431640625,2026-06-08 09:34:54.434478,2026-06-08 09:34:54.811067,0 days 00:00:00.376589,False,True,True,True,DecisionTree,dummy,diff,False,12,COMPLETE
415,22.60551269861375,2026-06-08 09:34:54.570613,2026-06-08 09:34:54.938748,0 days 00:00:00.368135,False,False,True,True,Lasso,dummy,standard,False,12,COMPLETE
416,22.62413338452694,2026-06-08 09:34:54.608406,2026-06-08 09:34:55.000045,0 days 00:00:00.391639,False,True,True,True,Lasso,dummy,standard,False,12,COMPLETE
417,22.60551269861375,2026-06-08 09:34:54.668864,2026-06-08 09:34:55.078563,0 days 00:00:00.409699,False,False,True,True,Lasso,dummy,standard,False,12,COMPLETE
418,22.60551269861375,2026-06-08 09:34:54.671708,2026-06-08 09:34:55.042278,0 days 00:00:00.370570,False,False,True,True,Lasso,dummy,standard,False,12,COMPLETE
419,22.60551269861375,2026-06-08 09:34:54.723643,2026-06-08 09:34:55.199688,0 days 00:00:00.476045,False,False,True,True,Lasso,dummy,standard,False,12,COMPLETE
420,22.60551269861375,2026-06-08 09:34:54.751681,2026-06-08 09:34:55.139709,0 days 00:00:00.388028,False,False,True,True,Lasso,dummy,standard,False,12,COMPLETE
421,22.60551269861375,2026-06-08 09:34:54.812354,2026-06-08 09:34:55.187686,0 days 00:00:00.375332,False,False,True,True,Lasso,dummy,standard,False,12,COMPLETE
422,22.60551269861375,2026-06-08 09:34:54.940087,2026-06-08 09:34:55.302736,0 days 00:00:00.362649,False,False,True,True,Lasso,dummy,standard,False,12,COMPLETE
423,28.010944961008157,2026-06-08 09:34:55.001788,2026-06-08 09:34:55.479061,0 days 00:00:00.477273,False,False,True,True,SVR_rbf,dummy,standard,False,12,COMPLETE
424,22.60551269861375,2026-06-08 09:34:55.044956,2026-06-08 09:34:55.419138,0 days 00:00:00.374182,False,False,True,True,Lasso,dummy,standard,False,12,COMPLETE
425,22.60551269861375,2026-06-08 09:34:55.080513,2026-06-08 09:34:55.489011,0 days 00:00:00.408498,False,False,True,True,Lasso,dummy,standard,False,12,COMPLETE
426,22.60551269861375,2026-06-08 09:34:55.144632,2026-06-08 09:34:55.574348,0 days 00:00:00.429716,False,False,True,True,Lasso,dummy,standard,False,12,COMPLETE
427,28.010944961008157,2026-06-08 09:34:55.188704,2026-06-08 09:34:55.613863,0 days 00:00:00.425159,False,False,True,True,SVR_rbf,dummy,standard,False,12,COMPLETE
428,22.60551269861375,2026-06-08 09:34:55.201805,2026-06-08 09:34:55.631988,0 days 00:00:00.430183,False,False,True,True,Lasso,dummy,standard,False,12,COMPLETE
429,28.010944961008157,2026-06-08 09:34:55.305637,2026-06-08 09:34:55.722526,0 days 00:00:00.416889,False,False,True,True,SVR_rbf,dummy,standard,False,12,COMPLETE
430,28.010944961008157,2026-06-08 09:34:55.420228,2026-06-08 09:34:55.919581,0 days 00:00:00.499353,False,False,True,True,SVR_rbf,dummy,standard,False,12,COMPLETE
431,22.7589107989374,2026-06-08 09:34:55.489726,2026-06-08 09:34:55.799534,0 days 00:00:00.309808,False,False,False,False,Lasso,dummy,standard,False,12,COMPLETE
432,22.7589107989374,2026-06-08 09:34:55.492388,2026-06-08 09:34:55.814334,0 days 00:00:00.321946,False,False,False,False,Lasso,dummy,standard,False,12,COMPLETE
433,22.7589107989374,2026-06-08 09:34:55.576550,2026-06-08 09:34:55.876476,0 days 00:00:00.299926,False,False,False,False,Lasso,dummy,standard,False,12,COMPLETE
434,22.58689201270056,2026-06-08 09:34:55.615042,2026-06-08 09:34:56.127135,0 days 00:00:00.512093,False,False,False,True,Lasso,dummy,standard,False,12,COMPLETE
435,22.58689201270056,2026-06-08 09:34:55.634617,2026-06-08 09:34:56.061261,0 days 00:00:00.426644,False,False,False,True,Lasso,dummy,standard,False,12,COMPLETE
436,22.58689201270056,2026-06-08 09:34:55.730930,2026-06-08 09:34:56.220086,0 days 00:00:00.489156,False,False,False,True,Lasso,dummy,standard,False,12,COMPLETE
437,24.78113171916867,2026-06-08 09:34:55.801378,2026-06-08 09:34:56.355316,0 days 00:00:00.553938,False,False,True,True,Lasso,winsorize,standard,False,24,COMPLETE
438,24.78113171916867,2026-06-08 09:34:55.817043,2026-06-08 09:34:56.462763,0 days 00:00:00.645720,False,False,True,True,Lasso,winsorize,standard,False,24,COMPLETE
439,22.60551269861375,2026-06-08 09:34:55.879640,2026-06-08 09:34:56.607633,0 days 00:00:00.727993,False,False,True,True,Lasso,winsorize,standard,False,12,COMPLETE
440,22.60551269861375,2026-06-08 09:34:55.921826,2026-06-08 09:34:56.580162,0 days 00:00:00.658336,False,False,True,True,Lasso,winsorize,standard,False,12,COMPLETE
441,22.58689201270056,2026-06-08 09:34:56.062979,2026-06-08 09:34:56.776103,0 days 00:00:00.713124,False,False,False,True,Lasso,winsorize,standard,False,12,COMPLETE
442,24.76091882289892,2026-06-08 09:34:56.128518,2026-06-08 09:34:56.799541,0 days 00:00:00.671023,False,False,False,True,Lasso,winsorize,standard,False,24,COMPLETE
443,22.58689201270056,2026-06-08 09:34:56.224863,2026-06-08 09:34:56.856367,0 days 00:00:00.631504,False,False,False,True,Lasso,winsorize,standard,False,12,COMPLETE
444,22.58689201270056,2026-06-08 09:34:56.357922,2026-06-08 09:34:56.882549,0 days 00:00:00.524627,False,False,False,True,Lasso,dummy,standard,False,12,COMPLETE
445,22.58689201270056,2026-06-08 09:34:56.466882,2026-06-08 09:34:57.003836,0 days 00:00:00.536954,False,False,False,True,Lasso,dummy,standard,False,12,COMPLETE
446,22.58689201270056,2026-06-08 09:34:56.582187,2026-06-08 09:34:57.090717,0 days 00:00:00.508530,False,False,False,True,Lasso,dummy,standard,False,12,COMPLETE
447,22.58689201270056,2026-06-08 09:34:56.614532,2026-06-08 09:34:57.098144,0 days 00:00:00.483612,False,False,False,True,Lasso,dummy,standard,False,12,COMPLETE
448,22.58689201270056,2026-06-08 09:34:56.779485,2026-06-08 09:34:57.509732,0 days 00:00:00.730247,False,False,False,True,Lasso,winsorize,standard,False,12,COMPLETE
449,22.58689201270056,2026-06-08 09:34:56.800813,2026-06-08 09:34:57.526441,0 days 00:00:00.725628,False,False,False,True,Lasso,winsorize,standard,False,12,COMPLETE
450,22.58689201270056,2026-06-08 09:34:56.858076,2026-06-08 09:34:57.483100,0 days 00:00:00.625024,False,False,False,True,Lasso,winsorize,standard,False,12,COMPLETE
451,22.58689201270056,2026-06-08 09:34:56.883847,2026-06-08 09:34:57.609708,0 days 00:00:00.725861,False,False,False,True,Lasso,winsorize,standard,False,12,COMPLETE
452,22.58689201270056,2026-06-08 09:34:57.012117,2026-06-08 09:34:57.712906,0 days 00:00:00.700789,False,False,False,True,Lasso,winsorize,standard,False,12,COMPLETE
453,22.58689201270056,2026-06-08 09:34:57.100147,2026-06-08 09:34:57.695457,0 days 00:00:00.595310,False,False,False,True,Lasso,winsorize,standard,False,12,COMPLETE
454,22.58689201270056,2026-06-08 09:34:57.104138,2026-06-08 09:34:57.806024,0 days 00:00:00.701886,False,False,False,True,Lasso,winsorize,standard,False,12,COMPLETE
455,22.58689201270056,2026-06-08 09:34:57.487098,2026-06-08 09:34:58.120779,0 days 00:00:00.633681,False,False,False,True,Lasso,winsorize,standard,False,12,COMPLETE
456,22.58689201270056,2026-06-08 09:34:57.511949,2026-06-08 09:34:58.164520,0 days 00:00:00.652571,False,False,False,True,Lasso,winsorize,standard,False,12,COMPLETE
457,22.58689201270056,2026-06-08 09:34:57.540347,2026-06-08 09:34:58.317146,0 days 00:00:00.776799,False,False,False,True,Lasso,winsorize,standard,False,12,COMPLETE
458,22.58689201270056,2026-06-08 09:34:57.616234,2026-06-08 09:34:58.293849,0 days 00:00:00.677615,False,False,False,True,Lasso,winsorize,standard,False,12,COMPLETE
459,22.58689201270056,2026-06-08 09:34:57.697926,2026-06-08 09:34:58.446822,0 days 00:00:00.748896,False,False,False,True,Lasso,winsorize,standard,False,12,COMPLETE
460,22.58689201270056,2026-06-08 09:34:57.717020,2026-06-08 09:34:58.375379,0 days 00:00:00.658359,False,False,False,True,Lasso,winsorize,standard,False,12,COMPLETE
461,22.58689201270056,2026-06-08 09:34:57.812204,2026-06-08 09:34:58.582302,0 days 00:00:00.770098,False,False,False,True,Lasso,winsorize,standard,False,12,COMPLETE
462,22.58689201270056,2026-06-08 09:34:58.126177,2026-06-08 09:34:58.871690,0 days 00:00:00.745513,False,False,False,True,Lasso,winsorize,standard,False,12,COMPLETE
463,22.58689201270056,2026-06-08 09:34:58.174264,2026-06-08 09:34:58.834208,0 days 00:00:00.659944,False,False,False,True,Lasso,winsorize,standard,False,12,COMPLETE
464,22.58689201270056,2026-06-08 09:34:58.298890,2026-06-08 09:34:59.002710,0 days 00:00:00.703820,False,False,False,True,Lasso,winsorize,standard,False,12,COMPLETE
465,22.58689201270056,2026-06-08 09:34:58.327195,2026-06-08 09:34:58.898553,0 days 00:00:00.571358,False,False,False,True,Lasso,winsorize,standard,False,12,COMPLETE
466,22.58689201270056,2026-06-08 09:34:58.377118,2026-06-08 09:34:59.177309,0 days 00:00:00.800191,False,False,False,True,Lasso,winsorize,standard,False,12,COMPLETE
467,22.58689201270056,2026-06-08 09:34:58.448955,2026-06-08 09:34:59.205743,0 days 00:00:00.756788,False,False,False,True,Lasso,winsorize,standard,False,12,COMPLETE
468,22.58689201270056,2026-06-08 09:34:58.584747,2026-06-08 09:34:59.259047,0 days 00:00:00.674300,False,False,False,True,Lasso,winsorize,standard,False,12,COMPLETE
469,22.58689201270056,2026-06-08 09:34:58.842456,2026-06-08 09:34:59.616117,0 days 00:00:00.773661,False,False,False,True,Lasso,winsorize,standard,False,12,COMPLETE
470,22.58689201270056,2026-06-08 09:34:58.873280,2026-06-08 09:34:59.583891,0 days 00:00:00.710611,False,False,False,True,Lasso,winsorize,standard,False,12,COMPLETE
471,26.501092847222218,2026-06-08 09:34:58.910916,2026-06-08 09:35:00.460054,0 days 00:00:01.549138,False,False,False,True,KNN,winsorize,standard,False,36,COMPLETE
472,26.630241616926426,2026-06-08 09:34:59.005064,2026-06-08 09:34:59.644574,0 days 00:00:00.639510,False,False,False,True,Lasso,winsorize,standard,False,36,COMPLETE
473,24.59734983072917,2026-06-08 09:34:59.179001,2026-06-08 09:34:59.874063,0 days 00:00:00.695062,False,False,False,True,KNN,winsorize,standard,False,12,COMPLETE
474,26.630241616926426,2026-06-08 09:34:59.209960,2026-06-08 09:34:59.787820,0 days 00:00:00.577860,False,False,False,True,Lasso,winsorize,standard,False,36,COMPLETE
475,26.630241616926426,2026-06-08 09:34:59.262910,2026-06-08 09:34:59.947042,0 days 00:00:00.684132,False,False,False,True,Lasso,winsorize,standard,False,36,COMPLETE
476,24.59734983072917,2026-06-08 09:34:59.595272,2026-06-08 09:35:00.380028,0 days 00:00:00.784756,False,False,False,True,KNN,winsorize,standard,False,12,COMPLETE
477,24.59734983072917,2026-06-08 09:34:59.620376,2026-06-08 09:35:00.446962,0 days 00:00:00.826586,False,False,False,True,KNN,winsorize,standard,False,12,COMPLETE
478,24.59734983072917,2026-06-08 09:34:59.646857,2026-06-08 09:35:00.402275,0 days 00:00:00.755418,False,False,False,True,KNN,winsorize,standard,False,12,COMPLETE
479,24.59734983072917,2026-06-08 09:34:59.790513,2026-06-08 09:35:00.587022,0 days 00:00:00.796509,False,False,False,True,KNN,winsorize,standard,False,12,COMPLETE
480,22.58689201270056,2026-06-08 09:34:59.875237,2026-06-08 09:35:00.575047,0 days 00:00:00.699810,False,False,False,True,Lasso,winsorize,standard,False,12,COMPLETE
481,22.58689201270056,2026-06-08 09:34:59.949957,2026-06-08 09:35:00.583663,0 days 00:00:00.633706,False,False,False,True,Lasso,winsorize,standard,False,12,COMPLETE
482,22.58689201270056,2026-06-08 09:35:00.381291,2026-06-08 09:35:01.083840,0 days 00:00:00.702549,False,False,False,True,Lasso,winsorize,standard,False,12,COMPLETE
483,22.58689201270056,2026-06-08 09:35:00.409467,2026-06-08 09:35:01.162545,0 days 00:00:00.753078,False,False,False,True,Lasso,winsorize,standard,False,12,COMPLETE
484,27.721307231687028,2026-06-08 09:35:00.451316,2026-06-08 09:35:01.208551,0 days 00:00:00.757235,False,False,False,True,Lasso,winsorize,log_diff,False,12,COMPLETE
485,27.721307231687028,2026-06-08 09:35:00.469979,2026-06-08 09:35:01.127578,0 days 00:00:00.657599,False,False,False,True,Lasso,winsorize,log_diff,False,12,COMPLETE
486,27.721307231687028,2026-06-08 09:35:00.587895,2026-06-08 09:35:01.304193,0 days 00:00:00.716298,False,False,False,True,Lasso,winsorize,log_diff,False,12,COMPLETE
487,22.58689201270056,2026-06-08 09:35:00.593746,2026-06-08 09:35:01.260569,0 days 00:00:00.666823,False,False,False,True,Lasso,winsorize,standard,False,12,COMPLETE
488,22.58689201270056,2026-06-08 09:35:00.598555,2026-06-08 09:35:01.288525,0 days 00:00:00.689970,False,False,False,True,Lasso,winsorize,standard,False,12,COMPLETE
489,22.58689201270056,2026-06-08 09:35:01.087707,2026-06-08 09:35:01.739450,0 days 00:00:00.651743,False,False,False,True,Lasso,winsorize,standard,False,12,COMPLETE
490,22.58689201270056,2026-06-08 09:35:01.131154,2026-06-08 09:35:01.859675,0 days 00:00:00.728521,False,False,False,True,Lasso,winsorize,standard,False,12,COMPLETE
491,22.7589107989374,2026-06-08 09:35:01.166601,2026-06-08 09:35:01.790526,0 days 00:00:00.623925,False,False,False,False,Lasso,winsorize,standard,False,12,COMPLETE
492,22.58689201270056,2026-06-08 09:35:01.212361,2026-06-08 09:35:01.952682,0 days 00:00:00.740321,False,False,False,True,Lasso,winsorize,standard,False,12,COMPLETE
493,22.7589107989374,2026-06-08 09:35:01.263564,2026-06-08 09:35:01.878001,0 days 00:00:00.614437,False,False,False,False,Lasso,winsorize,standard,False,12,COMPLETE
494,29.758868536283142,2026-06-08 09:35:01.294761,2026-06-08 09:35:02.042677,0 days 00:00:00.747916,False,False,False,True,LinearRegression,winsorize,standard,False,12,COMPLETE
495,29.758868536283142,2026-06-08 09:35:01.307708,2026-06-08 09:35:02.032255,0 days 00:00:00.724547,False,False,False,True,LinearRegression,winsorize,standard,False,12,COMPLETE
496,24.391639782595863,2026-06-08 09:35:01.740742,2026-06-08 09:35:02.171428,0 days 00:00:00.430686,False,False,False,False,LinearRegression,winsorize,standard,False,12,COMPLETE
497,26.345256947791587,2026-06-08 09:35:01.793686,2026-06-08 09:35:02.289271,0 days 00:00:00.495585,False,False,False,True,Lasso,winsorize,diff,False,12,COMPLETE
498,22.58689201270056,2026-06-08 09:35:01.860524,2026-06-08 09:35:02.282291,0 days 00:00:00.421767,False,False,False,True,Lasso,winsorize,standard,False,12,COMPLETE
499,22.58689201270056,2026-06-08 09:35:01.880217,2026-06-08 09:35:02.296217,0 days 00:00:00.416000,False,False,False,True,Lasso,winsorize,standard,False,12,COMPLETE
