number,value,datetime_start,datetime_complete,duration,params_model,params_strategy,params_transform,params_use_tda,params_window,state
464,26.74710159975076,2026-06-08 09:34:10.334460,2026-06-08 09:34:10.660966,0 days 00:00:00.326506,ElasticNet,dummy,log_diff,False,12,COMPLETE
465,26.74710159975076,2026-06-08 09:34:10.346706,2026-06-08 09:34:10.670953,0 days 00:00:00.324247,ElasticNet,dummy,log_diff,False,12,COMPLETE
466,26.080202255077708,2026-06-08 09:34:10.388029,2026-06-08 09:34:10.790796,0 days 00:00:00.402767,KNN,dummy,log_diff,False,12,COMPLETE
467,26.74710159975076,2026-06-08 09:34:10.431167,2026-06-08 09:34:10.787335,0 days 00:00:00.356168,ElasticNet,dummy,log_diff,False,12,COMPLETE
468,26.080202255077708,2026-06-08 09:34:10.502660,2026-06-08 09:34:10.953319,0 days 00:00:00.450659,KNN,dummy,log_diff,False,12,COMPLETE
469,26.74710159975076,2026-06-08 09:34:10.547017,2026-06-08 09:34:10.889230,0 days 00:00:00.342213,ElasticNet,dummy,log_diff,False,12,COMPLETE
470,26.74710159975076,2026-06-08 09:34:10.550728,2026-06-08 09:34:10.875815,0 days 00:00:00.325087,ElasticNet,dummy,log_diff,False,12,COMPLETE
471,28.17939493067078,2026-06-08 09:34:10.664969,2026-06-08 09:34:13.682290,0 days 00:00:03.017321,GradientBoosting,exclude,log_diff,False,12,COMPLETE
472,26.080202255077708,2026-06-08 09:34:10.672280,2026-06-08 09:34:11.023552,0 days 00:00:00.351272,KNN,exclude,log_diff,False,12,COMPLETE
473,26.080202255077708,2026-06-08 09:34:10.788616,2026-06-08 09:34:11.122906,0 days 00:00:00.334290,KNN,exclude,log_diff,False,12,COMPLETE
474,28.17939493067078,2026-06-08 09:34:10.796275,2026-06-08 09:34:13.789009,0 days 00:00:02.992734,GradientBoosting,exclude,log_diff,False,12,COMPLETE
475,28.17939493067078,2026-06-08 09:34:10.878301,2026-06-08 09:34:13.923272,0 days 00:00:03.044971,GradientBoosting,exclude,log_diff,False,12,COMPLETE
476,28.17939493067078,2026-06-08 09:34:10.893348,2026-06-08 09:34:13.722248,0 days 00:00:02.828900,GradientBoosting,exclude,log_diff,False,12,COMPLETE
477,22.84341258396829,2026-06-08 09:34:10.966236,2026-06-08 09:34:11.157850,0 days 00:00:00.191614,Ridge,exclude,log_diff,False,12,COMPLETE
478,28.17939493067078,2026-06-08 09:34:11.026381,2026-06-08 09:34:13.847065,0 days 00:00:02.820684,GradientBoosting,exclude,log_diff,False,12,COMPLETE
479,28.17939493067078,2026-06-08 09:34:11.129153,2026-06-08 09:34:14.209823,0 days 00:00:03.080670,GradientBoosting,exclude,log_diff,False,12,COMPLETE
480,22.84341258396829,2026-06-08 09:34:11.160337,2026-06-08 09:34:11.271681,0 days 00:00:00.111344,Ridge,exclude,log_diff,False,12,COMPLETE
481,22.84341258396829,2026-06-08 09:34:11.273416,2026-06-08 09:34:11.382764,0 days 00:00:00.109348,Ridge,exclude,log_diff,False,12,COMPLETE
482,22.84341258396829,2026-06-08 09:34:11.384784,2026-06-08 09:34:11.498948,0 days 00:00:00.114164,Ridge,exclude,log_diff,False,12,COMPLETE
483,28.17939493067078,2026-06-08 09:34:11.500059,2026-06-08 09:34:14.564843,0 days 00:00:03.064784,GradientBoosting,dummy,log_diff,False,12,COMPLETE
484,22.84341258396829,2026-06-08 09:34:13.683196,2026-06-08 09:34:13.813131,0 days 00:00:00.129935,Ridge,dummy,log_diff,False,12,COMPLETE
485,22.84341258396829,2026-06-08 09:34:13.723736,2026-06-08 09:34:13.891577,0 days 00:00:00.167841,Ridge,dummy,log_diff,False,12,COMPLETE
486,22.84341258396829,2026-06-08 09:34:13.790436,2026-06-08 09:34:14.035371,0 days 00:00:00.244935,Ridge,dummy,log_diff,False,12,COMPLETE
487,22.84341258396829,2026-06-08 09:34:13.815865,2026-06-08 09:34:14.067748,0 days 00:00:00.251883,Ridge,dummy,log_diff,False,12,COMPLETE
488,22.84341258396829,2026-06-08 09:34:13.850169,2026-06-08 09:34:14.089076,0 days 00:00:00.238907,Ridge,dummy,log_diff,False,12,COMPLETE
489,22.84341258396829,2026-06-08 09:34:13.892381,2026-06-08 09:34:14.130372,0 days 00:00:00.237991,Ridge,dummy,log_diff,False,12,COMPLETE
490,22.84341258396829,2026-06-08 09:34:13.925202,2026-06-08 09:34:14.166537,0 days 00:00:00.241335,Ridge,dummy,log_diff,False,12,COMPLETE
491,24.941082718702738,2026-06-08 09:34:14.043490,2026-06-08 09:34:14.311113,0 days 00:00:00.267623,Ridge,dummy,diff,False,12,COMPLETE
492,24.941082718702738,2026-06-08 09:34:14.069347,2026-06-08 09:34:14.351550,0 days 00:00:00.282203,Ridge,dummy,diff,False,12,COMPLETE
493,22.84341258396829,2026-06-08 09:34:14.095199,2026-06-08 09:34:14.339721,0 days 00:00:00.244522,Ridge,dummy,log_diff,False,12,COMPLETE
494,22.84341258396829,2026-06-08 09:34:14.132523,2026-06-08 09:34:14.426356,0 days 00:00:00.293833,Ridge,dummy,log_diff,False,12,COMPLETE
495,22.84341258396829,2026-06-08 09:34:14.178702,2026-06-08 09:34:14.434722,0 days 00:00:00.256020,Ridge,exclude,log_diff,False,12,COMPLETE
496,24.941082718702738,2026-06-08 09:34:14.211446,2026-06-08 09:34:14.458245,0 days 00:00:00.246799,Ridge,dummy,diff,False,12,COMPLETE
497,22.84341258396829,2026-06-08 09:34:14.317881,2026-06-08 09:34:14.544347,0 days 00:00:00.226466,Ridge,exclude,log_diff,False,12,COMPLETE
498,22.84341258396829,2026-06-08 09:34:14.353273,2026-06-08 09:34:14.551510,0 days 00:00:00.198237,Ridge,exclude,log_diff,False,12,COMPLETE
499,22.84341258396829,2026-06-08 09:34:14.361249,2026-06-08 09:34:14.536676,0 days 00:00:00.175427,Ridge,exclude,log_diff,False,12,COMPLETE
